<?xml version="1.0" encoding="UTF-8"?>

<students xmlns:xsi="http://www.w3.org/2001/XMLSchema-instance" xsi:noNamespaceSchemaLocation="students.xsd">

    <student>
        <name>Ali</name>
        <age>100</age>
        <RollNumber>101</RollNumber>
        <marks>88</marks>
    </student>


       <student>
        <name>Sara</name>
        <age>45</age>
        <RollNumber>102</RollNumber>
        <marks>90</marks>
    </student>

</students>